"play_id","game_id","team_id_for","team_id_against","event","secondaryType","x","y","period","periodType","periodTime","periodTimeRemaining","dateTime","goals_away","goals_home","description","st_x","st_y"
"2016020045_1","2016020045",NA,NA,"Game Scheduled",NA,NA,NA,"1","REGULAR",0,1200,2016-10-18 23:40:58,0,0,"Game Scheduled",NA,NA
"2016020045_2","2016020045",NA,NA,"Period Ready",NA,NA,NA,"1","REGULAR",0,1200,2016-10-19 01:35:28,0,0,"Period Ready",NA,NA
"2016020045_3","2016020045",NA,NA,"Period Start",NA,NA,NA,"1","REGULAR",0,1200,2016-10-19 01:40:50,0,0,"Period Start",NA,NA
"2016020045_4","2016020045","16","4","Faceoff",NA,0,0,"1","REGULAR",0,1200,2016-10-19 01:40:50,0,0,"Jonathan Toews faceoff won against Claude Giroux",0,0
"2016020045_5","2016020045","16","4","Shot","Wrist Shot",-71,9,"1","REGULAR",54,1146,2016-10-19 01:41:44,0,0,"Artem Anisimov Wrist Shot saved by Michal Neuvirth",71,-9
"2016020045_6","2016020045","16","4","Goal","Wrap-around",-88,5,"1","REGULAR",56,1144,2016-10-19 01:41:48,0,1,"Patrick Kane (1) Wrap-around, assists: Artem Anisimov (2), Brent Seabrook (2)",88,-5
"2016020045_7","2016020045","4","16","Faceoff",NA,0,0,"1","REGULAR",58,1142,2016-10-19 01:42:30,0,1,"Pierre-Edouard Bellemare faceoff won against Nick Schmaltz",0,0
"2016020045_8","2016020045","4","16","Shot","Wrist Shot",56,-7,"1","REGULAR",69,1131,2016-10-19 01:42:41,0,1,"Dale Weise Wrist Shot saved by Corey Crawford",56,-7
"2016020045_9","2016020045","16","4","Takeaway",NA,11,21,"1","REGULAR",78,1122,2016-10-19 01:42:49,0,1,"Takeaway by Nick Schmaltz",-11,-21
"2016020045_10","2016020045","16","4","Hit",NA,-68,37,"1","REGULAR",88,1112,2016-10-19 01:43:04,0,1,"Vinnie Hinostroza hit Brandon Manning",68,-37
"2016020045_11","2016020045","16","4","Hit",NA,99,-1,"1","REGULAR",106,1094,2016-10-19 01:43:18,0,1,"Michal Kempny hit Roman Lyubimov",-99,1
"2016020045_12","2016020045","16","4","Shot","Slap Shot",-37,-24,"1","REGULAR",133,1067,2016-10-19 01:43:45,0,1,"Duncan Keith Slap Shot saved by Michal Neuvirth",37,24
"2016020045_13","2016020045",NA,NA,"Stoppage",NA,NA,NA,"1","REGULAR",133,1067,2016-10-19 01:43:57,0,1,"Goalie Stopped",NA,NA
"2016020045_14","2016020045","16","4","Faceoff",NA,-69,-22,"1","REGULAR",133,1067,2016-10-19 01:44:14,0,1,"Jonathan Toews faceoff won against Claude Giroux",69,22
"2016020045_15","2016020045","4","16","Blocked Shot",NA,-71,11,"1","REGULAR",144,1056,2016-10-19 01:44:30,0,1,"Andrew MacDonald blocked shot from Tyler Motte",-71,11
"2016020045_16","2016020045","16","4","Giveaway",NA,50,36,"1","REGULAR",158,1042,2016-10-19 01:44:44,0,1,"Giveaway by Richard Panik",-50,-36
"2016020045_17","2016020045","4","16","Shot","Wrist Shot",57,-20,"1","REGULAR",168,1032,2016-10-19 01:44:54,0,1,"Wayne Simmonds Wrist Shot saved by Corey Crawford",57,-20
"2016020045_18","2016020045","16","4","Giveaway",NA,78,-9,"1","REGULAR",170,1030,2016-10-19 01:45:02,0,1,"Giveaway by Niklas Hjalmarsson",-78,9
"2016020045_19","2016020045","4","16","Shot","Slap Shot",34,14,"1","REGULAR",171,1029,2016-10-19 01:45:01,0,1,"Shayne Gostisbehere Slap Shot saved by Corey Crawford",34,14
"2016020045_20","2016020045","4","16","Shot","Wrist Shot",78,2,"1","REGULAR",172,1028,2016-10-19 01:45:10,0,1,"Michael Raffl Wrist Shot saved by Corey Crawford",78,2
"2016020045_21","2016020045","4","16","Missed Shot",NA,72,-5,"1","REGULAR",175,1025,2016-10-19 01:45:01,0,1,"Wayne Simmonds - Goalpost",72,-5
"2016020045_22","2016020045",NA,NA,"Stoppage",NA,NA,NA,"1","REGULAR",175,1025,2016-10-19 01:45:08,0,1,"Goalie Stopped",NA,NA
"2016020045_23","2016020045","16","4","Faceoff",NA,69,22,"1","REGULAR",175,1025,2016-10-19 01:45:29,0,1,"Marcus Kruger faceoff won against Sean Couturier",-69,-22
"2016020045_24","2016020045","4","16","Hit",NA,-91,-35,"1","REGULAR",235,965,2016-10-19 01:46:41,0,1,"Mark Streit hit Vinnie Hinostroza",-91,-35
"2016020045_25","2016020045","4","16","Hit",NA,54,36,"1","REGULAR",297,903,2016-10-19 01:47:43,0,1,"Wayne Simmonds hit Jordin Tootoo",54,36
"2016020045_26","2016020045",NA,NA,"Stoppage",NA,NA,NA,"1","REGULAR",315,885,2016-10-19 01:48:03,0,1,"Icing",NA,NA
"2016020045_27","2016020045","4","16","Faceoff",NA,69,22,"1","REGULAR",315,885,2016-10-19 01:48:17,0,1,"Boyd Gordon faceoff won against Jonathan Toews",69,22
"2016020045_28","2016020045","16","4","Blocked Shot",NA,46,2,"1","REGULAR",318,882,2016-10-19 01:48:27,0,1,"Tyler Motte blocked shot from Brandon Manning",-46,-2
"2016020045_29","2016020045","4","16","Hit",NA,98,-14,"1","REGULAR",325,875,2016-10-19 01:48:33,0,1,"Roman Lyubimov hit Brian Campbell",98,-14
"2016020045_30","2016020045","16","4","Giveaway",NA,71,1,"1","REGULAR",326,874,2016-10-19 01:48:38,0,1,"Giveaway by Gustav Forsling",-71,-1
"2016020045_31","2016020045","4","16","Shot","Wrist Shot",61,17,"1","REGULAR",328,872,2016-10-19 01:48:38,0,1,"Chris VandeVelde Wrist Shot saved by Corey Crawford",61,17
"2016020045_32","2016020045",NA,NA,"Stoppage",NA,NA,NA,"1","REGULAR",333,867,2016-10-19 01:48:44,0,1,"Offside",NA,NA
"2016020045_33","2016020045","16","4","Faceoff",NA,-20,22,"1","REGULAR",333,867,2016-10-19 01:49:02,0,1,"Artem Anisimov faceoff won against Sean Couturier",20,-22
"2016020045_34","2016020045","4","16","Missed Shot",NA,79,26,"1","REGULAR",353,847,2016-10-19 01:49:26,0,1,"Travis Konecny - Wide of Net",79,26
"2016020045_35","2016020045","16","4","Takeaway",NA,38,-36,"1","REGULAR",367,833,2016-10-19 01:49:40,0,1,"Takeaway by Artemi Panarin",-38,36
"2016020045_36","2016020045",NA,NA,"Stoppage",NA,NA,NA,"1","REGULAR",369,831,2016-10-19 01:49:46,0,1,"Icing",NA,NA
"2016020045_37","2016020045","4","16","Faceoff",NA,69,-22,"1","REGULAR",369,831,2016-10-19 01:49:59,0,1,"Claude Giroux faceoff won against Artem Anisimov",69,-22
"2016020045_38","2016020045","4","16","Shot","Wrist Shot",44,-33,"1","REGULAR",373,827,2016-10-19 01:50:14,0,1,"Shayne Gostisbehere Wrist Shot saved by Corey Crawford",44,-33
"2016020045_39","2016020045","16","4","Hit",NA,92,12,"1","REGULAR",375,825,2016-10-19 01:50:15,0,1,"Brent Seabrook hit Wayne Simmonds",-92,-12
"2016020045_40","2016020045","4","16","Giveaway",NA,-91,26,"1","REGULAR",386,814,2016-10-19 01:50:26,0,1,"Giveaway by Andrew MacDonald",-91,26
"2016020045_41","2016020045","16","4","Penalty","Hooking",8,17,"1","REGULAR",397,803,2016-10-19 01:50:44,0,1,"Tyler Motte Hooking against Claude Giroux",-8,-17
"2016020045_42","2016020045",NA,NA,"Stoppage",NA,NA,NA,"1","REGULAR",397,803,2016-10-19 01:50:44,0,1,"TV timeout",NA,NA
"2016020045_43","2016020045","4","16","Faceoff",NA,69,22,"1","REGULAR",397,803,2016-10-19 01:52:29,0,1,"Claude Giroux faceoff won against Marcus Kruger",69,22
"2016020045_44","2016020045","4","16","Missed Shot",NA,44,11,"1","REGULAR",408,792,2016-10-19 01:53:15,0,1,"Claude Giroux - Wide of Net",44,11
"2016020045_45","2016020045","16","4","Blocked Shot",NA,78,-8,"1","REGULAR",414,786,2016-10-19 01:53:21,0,1,"Niklas Hjalmarsson blocked shot from Shayne Gostisbehere",-78,8
"2016020045_46","2016020045","4","16","Missed Shot",NA,74,0,"1","REGULAR",488,712,2016-10-19 01:54:36,0,1,"Dale Weise - Wide of Net",74,0
"2016020045_47","2016020045",NA,NA,"Stoppage",NA,NA,NA,"1","REGULAR",552,648,2016-10-19 01:55:42,0,1,"Icing",NA,NA
"2016020045_48","2016020045","4","16","Faceoff",NA,69,22,"1","REGULAR",552,648,2016-10-19 01:55:57,0,1,"Boyd Gordon faceoff won against Artem Anisimov",69,22
"2016020045_49","2016020045","4","16","Hit",NA,93,33,"1","REGULAR",561,639,2016-10-19 01:56:24,0,1,"Michael Raffl hit Brian Campbell",93,33
"2016020045_50","2016020045","16","4","Blocked Shot",NA,63,5,"1","REGULAR",584,616,2016-10-19 01:56:46,0,1,"Gustav Forsling blocked shot from Brandon Manning",-63,-5
"2016020045_51","2016020045","16","4","Shot","Wrist Shot",-75,-15,"1","REGULAR",605,595,2016-10-19 01:57:07,0,1,"Marian Hossa Wrist Shot saved by Michal Neuvirth",75,15
"2016020045_52","2016020045","16","4","Giveaway",NA,84,32,"1","REGULAR",614,586,2016-10-19 01:57:17,0,1,"Giveaway by Brent Seabrook",-84,-32
"2016020045_53","2016020045","16","4","Takeaway",NA,-94,14,"1","REGULAR",638,562,2016-10-19 01:57:41,0,1,"Takeaway by Richard Panik",94,-14
"2016020045_54","2016020045",NA,NA,"Stoppage",NA,NA,NA,"1","REGULAR",658,542,2016-10-19 01:58:05,0,1,"Offside",NA,NA
"2016020045_55","2016020045","16","4","Faceoff",NA,20,22,"1","REGULAR",658,542,2016-10-19 02:00:12,0,1,"Jonathan Toews faceoff won against Claude Giroux",-20,-22
"2016020045_56","2016020045","4","16","Hit",NA,98,-25,"1","REGULAR",668,532,2016-10-19 02:00:27,0,1,"Michael Raffl hit Niklas Hjalmarsson",98,-25
"2016020045_57","2016020045","4","16","Hit",NA,94,23,"1","REGULAR",675,525,2016-10-19 02:00:34,0,1,"Michael Raffl hit Niklas Hjalmarsson",94,23
"2016020045_58","2016020045","16","4","Shot","Wrist Shot",-75,20,"1","REGULAR",689,511,2016-10-19 02:00:48,0,1,"Tyler Motte Wrist Shot saved by Michal Neuvirth",75,-20
"2016020045_59","2016020045",NA,NA,"Stoppage",NA,NA,NA,"1","REGULAR",689,511,2016-10-19 02:00:51,0,1,"Goalie Stopped",NA,NA
"2016020045_60","2016020045","4","16","Faceoff",NA,-69,22,"1","REGULAR",689,511,2016-10-19 02:01:12,0,1,"Pierre-Edouard Bellemare faceoff won against Nick Schmaltz",-69,22
"2016020045_61","2016020045","4","16","Hit",NA,13,40,"1","REGULAR",699,501,2016-10-19 02:01:29,0,1,"Brandon Manning hit Marian Hossa",13,40
"2016020045_62","2016020045",NA,NA,"Stoppage",NA,NA,NA,"1","REGULAR",699,501,2016-10-19 02:01:33,0,1,"Puck in Benches",NA,NA
"2016020045_63","2016020045","4","16","Faceoff",NA,20,22,"1","REGULAR",699,501,2016-10-19 02:01:44,0,1,"Pierre-Edouard Bellemare faceoff won against Nick Schmaltz",20,22
"2016020045_64","2016020045","16","4","Giveaway",NA,95,-1,"1","REGULAR",710,490,2016-10-19 02:02:06,0,1,"Giveaway by Brian Campbell",-95,1
"2016020045_65","2016020045","4","16","Hit",NA,93,34,"1","REGULAR",736,464,2016-10-19 02:02:31,0,1,"Matt Read hit Brian Campbell",93,34
"2016020045_66","2016020045","4","16","Giveaway",NA,-39,-18,"1","REGULAR",747,453,2016-10-19 02:02:41,0,1,"Giveaway by Mark Streit",-39,-18
"2016020045_67","2016020045","4","16","Shot","Tip-In",76,-29,"1","REGULAR",759,441,2016-10-19 02:02:54,0,1,"Mark Streit Tip-In saved by Corey Crawford",76,-29
"2016020045_68","2016020045","16","4","Shot","Wrist Shot",-67,29,"1","REGULAR",769,431,2016-10-19 02:03:08,0,1,"Patrick Kane Wrist Shot saved by Michal Neuvirth",67,-29
"2016020045_69","2016020045",NA,NA,"Stoppage",NA,NA,NA,"1","REGULAR",770,430,2016-10-19 02:03:06,0,1,"Goalie Stopped",NA,NA
"2016020045_70","2016020045","4","16","Faceoff",NA,-69,22,"1","REGULAR",770,430,2016-10-19 02:03:28,0,1,"Claude Giroux faceoff won against Jonathan Toews",-69,22
"2016020045_71","2016020045","16","4","Shot","Wrist Shot",-37,-32,"1","REGULAR",789,411,2016-10-19 02:03:55,0,1,"Duncan Keith Wrist Shot saved by Michal Neuvirth",37,32
"2016020045_72","2016020045","4","16","Hit",NA,-46,-37,"1","REGULAR",793,407,2016-10-19 02:03:59,0,1,"Wayne Simmonds hit Tyler Motte",-46,-37
"2016020045_73","2016020045","16","4","Hit",NA,73,40,"1","REGULAR",806,394,2016-10-19 02:04:12,0,1,"Richard Panik hit Wayne Simmonds",-73,-40
"2016020045_74","2016020045","4","16","Shot","Wrist Shot",45,30,"1","REGULAR",808,392,2016-10-19 02:04:14,0,1,"Brandon Manning Wrist Shot saved by Corey Crawford",45,30
"2016020045_75","2016020045",NA,NA,"Stoppage",NA,NA,NA,"1","REGULAR",808,392,2016-10-19 02:04:16,0,1,"Goalie Stopped",NA,NA
"2016020045_76","2016020045","16","4","Faceoff",NA,69,22,"1","REGULAR",808,392,2016-10-19 02:04:35,0,1,"Marcus Kruger faceoff won against Boyd Gordon",-69,-22
"2016020045_77","2016020045","4","16","Hit",NA,36,-37,"1","REGULAR",813,387,2016-10-19 02:04:49,0,1,"Brandon Manning hit Dennis Rasmussen",36,-37
"2016020045_78","2016020045","16","4","Giveaway",NA,97,5,"1","REGULAR",833,367,2016-10-19 02:05:09,0,1,"Giveaway by Brian Campbell",-97,-5
"2016020045_79","2016020045","4","16","Giveaway",NA,-69,-37,"1","REGULAR",855,345,2016-10-19 02:05:44,0,1,"Giveaway by Chris VandeVelde",-69,-37
"2016020045_80","2016020045","4","16","Blocked Shot",NA,-77,-4,"1","REGULAR",856,344,2016-10-19 02:05:43,0,1,"Nick Schultz blocked shot from Gustav Forsling",-77,-4
"2016020045_81","2016020045","16","4","Shot","Wrist Shot",-77,-6,"1","REGULAR",858,342,2016-10-19 02:05:35,0,1,"Jordin Tootoo Wrist Shot saved by Michal Neuvirth",77,6
"2016020045_82","2016020045",NA,NA,"Stoppage",NA,NA,NA,"1","REGULAR",858,342,2016-10-19 02:05:53,0,1,"Goalie Stopped",NA,NA
"2016020045_83","2016020045","4","16","Faceoff",NA,-69,-22,"1","REGULAR",858,342,2016-10-19 02:07:39,0,1,"Sean Couturier faceoff won against Artem Anisimov",-69,-22
"2016020045_84","2016020045","16","4","Shot","Snap Shot",-46,-10,"1","REGULAR",911,289,2016-10-19 02:08:47,0,1,"Niklas Hjalmarsson Snap Shot saved by Michal Neuvirth",46,10
"2016020045_85","2016020045",NA,NA,"Stoppage",NA,NA,NA,"1","REGULAR",930,270,2016-10-19 02:09:16,0,1,"Icing",NA,NA
"2016020045_86","2016020045","16","4","Faceoff",NA,69,22,"1","REGULAR",930,270,2016-10-19 02:09:24,0,1,"Jonathan Toews faceoff won against Claude Giroux",-69,-22
"2016020045_87","2016020045","4","16","Hit",NA,-87,35,"1","REGULAR",950,250,2016-10-19 02:09:53,0,1,"Wayne Simmonds hit Richard Panik",-87,35
"2016020045_88","2016020045","16","4","Hit",NA,55,37,"1","REGULAR",964,236,2016-10-19 02:10:06,0,1,"Tyler Motte hit Wayne Simmonds",-55,-37
"2016020045_89","2016020045","4","16","Hit",NA,10,35,"1","REGULAR",973,227,2016-10-19 02:10:23,0,1,"Dale Weise hit Richard Panik",10,35
"2016020045_90","2016020045",NA,NA,"Stoppage",NA,NA,NA,"1","REGULAR",1001,199,2016-10-19 02:10:48,0,1,"Icing",NA,NA
"2016020045_91","2016020045","16","4","Faceoff",NA,69,22,"1","REGULAR",1001,199,2016-10-19 02:10:59,0,1,"Nick Schmaltz faceoff won against Boyd Gordon",-69,-22
"2016020045_92","2016020045","4","16","Hit",NA,92,33,"1","REGULAR",1012,188,2016-10-19 02:11:19,0,1,"Roman Lyubimov hit Brian Campbell",92,33
"2016020045_93","2016020045",NA,NA,"Stoppage",NA,NA,NA,"1","REGULAR",1018,182,2016-10-19 02:11:26,0,1,"Offside",NA,NA
"2016020045_94","2016020045","16","4","Faceoff",NA,20,22,"1","REGULAR",1018,182,2016-10-19 02:11:39,0,1,"Marcus Kruger faceoff won against Boyd Gordon",-20,-22
"2016020045_95","2016020045","4","16","Takeaway",NA,48,37,"1","REGULAR",1030,170,2016-10-19 02:11:56,0,1,"Takeaway by Boyd Gordon",48,37
"2016020045_96","2016020045","4","16","Giveaway",NA,-39,-17,"1","REGULAR",1046,154,2016-10-19 02:12:13,0,1,"Giveaway by Ivan Provorov",-39,-17
"2016020045_97","2016020045","16","4","Goal","Backhand",-76,1,"1","REGULAR",1046,154,2016-10-19 02:12:13,0,2,"Dennis Rasmussen (1) Backhand, assists: none",76,-1
"2016020045_98","2016020045","4","16","Faceoff",NA,0,0,"1","REGULAR",1046,154,2016-10-19 02:12:37,0,2,"Sean Couturier faceoff won against Artem Anisimov",0,0
"2016020045_99","2016020045","4","16","Blocked Shot",NA,-72,-14,"1","REGULAR",1068,132,2016-10-19 02:13:35,0,2,"Shayne Gostisbehere blocked shot from Michal Kempny",-72,-14
"2016020045_100","2016020045","4","16","Giveaway",NA,-63,39,"1","REGULAR",1079,121,2016-10-19 02:13:44,0,2,"Giveaway by Jakub Voracek",-63,39
"2016020045_101","2016020045","4","16","Penalty","Closing hand on puck",-78,1,"1","REGULAR",1079,121,2016-10-19 02:13:51,0,2,"Shayne Gostisbehere Closing hand on puck",-78,1
"2016020045_102","2016020045","16","4","Faceoff",NA,-69,-22,"1","REGULAR",1079,121,2016-10-19 02:14:11,0,2,"Jonathan Toews faceoff won against Boyd Gordon",69,22
"2016020045_103","2016020045","16","4","Goal","Slap Shot",-67,-28,"1","REGULAR",1092,108,2016-10-19 02:14:30,0,3,"Artemi Panarin (1) Slap Shot, assists: Brent Seabrook (3), Duncan Keith (4)",67,28
"2016020045_104","2016020045","16","4","Faceoff",NA,0,0,"1","REGULAR",1092,108,2016-10-19 02:15:14,0,3,"Jonathan Toews faceoff won against Claude Giroux",0,0
"2016020045_105","2016020045","16","4","Giveaway",NA,57,-34,"1","REGULAR",1132,68,2016-10-19 02:15:58,0,3,"Giveaway by Duncan Keith",-57,34
"2016020045_106","2016020045","4","16","Giveaway",NA,-94,-21,"1","REGULAR",1152,48,2016-10-19 02:16:19,0,3,"Giveaway by Nick Schultz",-94,-21
"2016020045_107","2016020045","4","16","Hit",NA,42,-36,"1","REGULAR",1165,35,2016-10-19 02:16:31,0,3,"Pierre-Edouard Bellemare hit Michal Kempny",42,-36
"2016020045_108","2016020045",NA,NA,"Stoppage",NA,NA,NA,"1","REGULAR",1181,19,2016-10-19 02:16:49,0,3,"Offside",NA,NA
"2016020045_109","2016020045","16","4","Faceoff",NA,20,-22,"1","REGULAR",1181,19,2016-10-19 02:17:03,0,3,"Artem Anisimov faceoff won against Sean Couturier",-20,22
"2016020045_110","2016020045",NA,NA,"Period End",NA,NA,NA,"1","REGULAR",1200,0,2016-10-19 02:17:35,0,3,"End of 1st Period",NA,NA
"2016020045_111","2016020045",NA,NA,"Period Official",NA,NA,NA,"1","REGULAR",1200,0,2016-10-19 02:17:44,0,3,"Period Official",NA,NA
"2016020045_112","2016020045",NA,NA,"Period Ready",NA,NA,NA,"2","REGULAR",0,1200,2016-10-19 02:34:02,0,3,"Period Ready",NA,NA
"2016020045_113","2016020045",NA,NA,"Period Start",NA,NA,NA,"2","REGULAR",0,1200,2016-10-19 02:36:04,0,3,"Period Start",NA,NA
"2016020045_114","2016020045","4","16","Faceoff",NA,0,0,"2","REGULAR",0,1200,2016-10-19 02:36:04,0,3,"Claude Giroux faceoff won against Jonathan Toews",0,0
"2016020045_115","2016020045",NA,NA,"Stoppage",NA,NA,NA,"2","REGULAR",14,1186,2016-10-19 02:36:23,0,3,"Offside",NA,NA
"2016020045_116","2016020045","16","4","Faceoff",NA,-69,-22,"2","REGULAR",14,1186,2016-10-19 02:36:39,0,3,"Jonathan Toews faceoff won against Claude Giroux",-69,-22
"2016020045_117","2016020045","16","4","Shot","Slap Shot",42,-2,"2","REGULAR",35,1165,2016-10-19 02:37:08,0,3,"Duncan Keith Slap Shot saved by Michal Neuvirth",42,-2
"2016020045_118","2016020045","16","4","Shot","Wrist Shot",57,-17,"2","REGULAR",41,1159,2016-10-19 02:37:14,0,3,"Tyler Motte Wrist Shot saved by Michal Neuvirth",57,-17
"2016020045_119","2016020045","16","4","Hit",NA,96,25,"2","REGULAR",46,1154,2016-10-19 02:37:19,0,3,"Jonathan Toews hit Andrew MacDonald",96,25
"2016020045_120","2016020045","16","4","Shot","Wrist Shot",84,-6,"2","REGULAR",49,1151,2016-10-19 02:37:23,0,3,"Jonathan Toews Wrist Shot saved by Michal Neuvirth",84,-6
"2016020045_121","2016020045",NA,NA,"Stoppage",NA,NA,NA,"2","REGULAR",53,1147,2016-10-19 02:37:30,0,3,"Icing",NA,NA
"2016020045_122","2016020045","16","4","Faceoff",NA,69,-22,"2","REGULAR",53,1147,2016-10-19 02:37:45,0,3,"Artem Anisimov faceoff won against Claude Giroux",69,-22
"2016020045_123","2016020045",NA,NA,"Stoppage",NA,NA,NA,"2","REGULAR",61,1139,2016-10-19 02:38:05,0,3,"Icing",NA,NA
"2016020045_124","2016020045","4","16","Faceoff",NA,69,-22,"2","REGULAR",61,1139,2016-10-19 02:38:16,0,3,"Claude Giroux faceoff won against Patrick Kane",-69,22
"2016020045_125","2016020045","4","16","Blocked Shot",NA,79,-7,"2","REGULAR",79,1121,2016-10-19 02:38:52,0,3,"Sean Couturier blocked shot from Brent Seabrook",-79,7
"2016020045_126","2016020045",NA,NA,"Stoppage",NA,NA,NA,"2","REGULAR",79,1121,2016-10-19 02:38:53,0,3,"Puck in Netting",NA,NA
"2016020045_127","2016020045","16","4","Faceoff",NA,69,-22,"2","REGULAR",79,1121,2016-10-19 02:39:09,0,3,"Nick Schmaltz faceoff won against Sean Couturier",69,-22
"2016020045_128","2016020045","4","16","Takeaway",NA,67,37,"2","REGULAR",106,1094,2016-10-19 02:39:42,0,3,"Takeaway by Sean Couturier",-67,-37
"2016020045_129","2016020045",NA,NA,"Stoppage",NA,NA,NA,"2","REGULAR",106,1094,2016-10-19 02:39:45,0,3,"Offside",NA,NA
"2016020045_130","2016020045","4","16","Faceoff",NA,20,22,"2","REGULAR",106,1094,2016-10-19 02:39:59,0,3,"Pierre-Edouard Bellemare faceoff won against Artem Anisimov",-20,-22
"2016020045_131","2016020045","4","16","Takeaway",NA,-50,17,"2","REGULAR",119,1081,2016-10-19 02:40:16,0,3,"Takeaway by Matt Read",50,-17
"2016020045_132","2016020045","16","4","Hit",NA,-92,27,"2","REGULAR",132,1068,2016-10-19 02:40:30,0,3,"Gustav Forsling hit Pierre-Edouard Bellemare",-92,27
"2016020045_133","2016020045","4","16","Takeaway",NA,-91,36,"2","REGULAR",146,1054,2016-10-19 02:40:44,0,3,"Takeaway by Dale Weise",91,-36
"2016020045_134","2016020045","4","16","Penalty","Hooking",82,-10,"2","REGULAR",187,1013,2016-10-19 02:41:30,0,3,"Boyd Gordon Hooking against Dennis Rasmussen",-82,10
"2016020045_135","2016020045","4","16","Faceoff",NA,69,22,"2","REGULAR",187,1013,2016-10-19 02:41:48,0,3,"Claude Giroux faceoff won against Jonathan Toews",-69,-22
"2016020045_136","2016020045","16","4","Hit",NA,97,10,"2","REGULAR",202,998,2016-10-19 02:42:19,0,3,"Jonathan Toews hit Ivan Provorov",97,10
"2016020045_137","2016020045","16","4","Shot","Wrist Shot",58,17,"2","REGULAR",232,968,2016-10-19 02:42:50,0,3,"Patrick Kane Wrist Shot saved by Michal Neuvirth",58,17
"2016020045_138","2016020045","4","16","Blocked Shot",NA,59,3,"2","REGULAR",240,960,2016-10-19 02:42:57,0,3,"Matt Read blocked shot from Duncan Keith",-59,-3
"2016020045_139","2016020045","4","16","Hit",NA,-96,7,"2","REGULAR",288,912,2016-10-19 02:43:45,0,3,"Wayne Simmonds hit Gustav Forsling",96,-7
"2016020045_140","2016020045","16","4","Goal","Backhand",83,-11,"2","REGULAR",304,896,2016-10-19 02:44:03,0,4,"Marian Hossa (1) Backhand, assists: Artem Anisimov (3), Brian Campbell (1)",83,-11
"2016020045_141","2016020045","16","4","Faceoff",NA,0,0,"2","REGULAR",304,896,2016-10-19 02:45:42,0,4,"Jonathan Toews faceoff won against Claude Giroux",0,0
"2016020045_142","2016020045","16","4","Hit",NA,47,-38,"2","REGULAR",320,880,2016-10-19 02:46:05,0,4,"Richard Panik hit Michael Raffl",47,-38
"2016020045_143","2016020045","4","16","Hit",NA,25,36,"2","REGULAR",366,834,2016-10-19 02:47:00,0,4,"Brandon Manning hit Tyler Motte",-25,-36
"2016020045_144","2016020045","4","16","Hit",NA,-95,20,"2","REGULAR",413,787,2016-10-19 02:47:38,0,4,"Chris VandeVelde hit Michal Kempny",95,-20
"2016020045_145","2016020045","16","4","Giveaway",NA,-53,38,"2","REGULAR",429,771,2016-10-19 02:47:54,0,4,"Giveaway by Artemi Panarin",-53,38
"2016020045_146","2016020045","4","16","Shot","Wrist Shot",-46,-2,"2","REGULAR",431,769,2016-10-19 02:47:56,0,4,"Chris VandeVelde Wrist Shot saved by Corey Crawford",46,2
"2016020045_147","2016020045","16","4","Hit",NA,-86,-38,"2","REGULAR",435,765,2016-10-19 02:48:00,0,4,"Brent Seabrook hit Roman Lyubimov",-86,-38
"2016020045_148","2016020045","16","4","Giveaway",NA,-94,-7,"2","REGULAR",449,751,2016-10-19 02:48:14,0,4,"Giveaway by Brent Seabrook",-94,-7
"2016020045_149","2016020045","16","4","Giveaway",NA,-78,25,"2","REGULAR",458,742,2016-10-19 02:48:23,0,4,"Giveaway by Michal Kempny",-78,25
"2016020045_150","2016020045","4","16","Shot","Wrist Shot",-57,3,"2","REGULAR",460,740,2016-10-19 02:48:26,0,4,"Pierre-Edouard Bellemare Wrist Shot saved by Corey Crawford",57,-3
"2016020045_151","2016020045","4","16","Takeaway",NA,72,-38,"2","REGULAR",475,725,2016-10-19 02:48:40,0,4,"Takeaway by Dale Weise",-72,38
"2016020045_152","2016020045","4","16","Blocked Shot",NA,79,2,"2","REGULAR",507,693,2016-10-19 02:49:12,0,4,"Pierre-Edouard Bellemare blocked shot from Gustav Forsling",-79,-2
"2016020045_153","2016020045","4","16","Shot","Wrist Shot",-80,17,"2","REGULAR",514,686,2016-10-19 02:49:19,0,4,"Wayne Simmonds Wrist Shot saved by Corey Crawford",80,-17
"2016020045_154","2016020045",NA,NA,"Stoppage",NA,NA,NA,"2","REGULAR",514,686,2016-10-19 02:49:20,0,4,"Goalie Stopped",NA,NA
"2016020045_155","2016020045","16","4","Faceoff",NA,-69,22,"2","REGULAR",514,686,2016-10-19 02:51:39,0,4,"Jonathan Toews faceoff won against Claude Giroux",-69,22
"2016020045_156","2016020045","16","4","Blocked Shot",NA,-70,4,"2","REGULAR",529,671,2016-10-19 02:51:59,0,4,"Duncan Keith blocked shot from Brandon Manning",-70,4
"2016020045_157","2016020045","4","16","Missed Shot",NA,-37,-18,"2","REGULAR",539,661,2016-10-19 02:52:09,0,4,"Nick Schultz - Over Net",37,18
"2016020045_158","2016020045",NA,NA,"Stoppage",NA,NA,NA,"2","REGULAR",543,657,2016-10-19 02:52:14,0,4,"Goalie Stopped",NA,NA
"2016020045_159","2016020045","4","16","Faceoff",NA,-69,22,"2","REGULAR",543,657,2016-10-19 02:52:35,0,4,"Sean Couturier faceoff won against Marcus Kruger",69,-22
"2016020045_160","2016020045","16","4","Hit",NA,-96,15,"2","REGULAR",557,643,2016-10-19 02:52:58,0,4,"Michal Kempny hit Travis Konecny",-96,15
"2016020045_161","2016020045","4","16","Hit",NA,10,36,"2","REGULAR",568,632,2016-10-19 02:53:09,0,4,"Mark Streit hit Dennis Rasmussen",-10,-36
"2016020045_162","2016020045","4","16","Hit",NA,98,29,"2","REGULAR",578,622,2016-10-19 02:53:18,0,4,"Ivan Provorov hit Jordin Tootoo",-98,-29
"2016020045_163","2016020045","4","16","Giveaway",NA,58,-38,"2","REGULAR",599,601,2016-10-19 02:53:40,0,4,"Giveaway by Mark Streit",-58,38
"2016020045_164","2016020045","16","4","Shot","Wrist Shot",70,15,"2","REGULAR",602,598,2016-10-19 02:53:43,0,4,"Artemi Panarin Wrist Shot saved by Steve Mason",70,15
"2016020045_165","2016020045","16","4","Shot","Backhand",79,7,"2","REGULAR",623,577,2016-10-19 02:54:04,0,4,"Patrick Kane Backhand saved by Steve Mason",79,7
"2016020045_166","2016020045","16","4","Missed Shot",NA,48,-27,"2","REGULAR",638,562,2016-10-19 02:54:19,0,4,"Brian Campbell - Wide of Net",48,-27
"2016020045_167","2016020045",NA,NA,"Stoppage",NA,NA,NA,"2","REGULAR",679,521,2016-10-19 02:55:01,0,4,"Puck in Benches",NA,NA
"2016020045_168","2016020045","4","16","Faceoff",NA,-20,22,"2","REGULAR",679,521,2016-10-19 02:56:52,0,4,"Claude Giroux faceoff won against Jonathan Toews",20,-22
"2016020045_169","2016020045","4","16","Hit",NA,-97,17,"2","REGULAR",720,480,2016-10-19 02:57:54,0,4,"Wayne Simmonds hit Niklas Hjalmarsson",97,-17
"2016020045_170","2016020045","16","4","Shot","Slap Shot",61,25,"2","REGULAR",731,469,2016-10-19 02:58:05,0,4,"Michal Kempny Slap Shot saved by Steve Mason",61,25
"2016020045_171","2016020045",NA,NA,"Stoppage",NA,NA,NA,"2","REGULAR",731,469,2016-10-19 02:58:08,0,4,"Goalie Stopped",NA,NA
"2016020045_172","2016020045","4","16","Faceoff",NA,69,22,"2","REGULAR",731,469,2016-10-19 02:58:26,0,4,"Sean Couturier faceoff won against Artem Anisimov",-69,-22
"2016020045_173","2016020045","4","16","Takeaway",NA,5,-29,"2","REGULAR",749,451,2016-10-19 02:58:51,0,4,"Takeaway by Nick Schultz",-5,29
